{
  "$schema": "contracts/instruction-surfaces.schema.json",
  "schema_version": 2,
  "precedence_rule": "Assembly order records prompt composition, not instruction authority. Provider and host instruction hierarchy governs conflicts; later user, project, retrieved, or worker content does not override higher-authority instructions. Native host rules resolve precedence within a supported authority level.",
  "exclusions": [
    "This standing-instruction index is one part of the effective-context audit. Skill catalogs and bodies, tool schemas, hooks, and memory injection mechanisms must also be inspected, including those excluded from recovery.",
    "Credentials, auth state, personal memory contents, sessions, logs, caches, and generated plugin caches are excluded from recovery artifacts. Their injection and discovery mechanisms remain subject to audit.",
    "Project-local instruction files are discovered at runtime and remain owned by their project unless explicitly admitted elsewhere."
  ],
  "surfaces": [
    {
      "id": "portable.core-reference",
      "hosts": [
        "codex",
        "hermes",
        "omp"
      ],
      "kind": "portable-reference",
      "scope": "user-global",
      "status": "reference",
      "owner": "surfaces/core.md",
      "artifact": "surfaces/core.md",
      "model_sensitive": true,
      "backup": "not-effective",
      "note": "Owns shared standing-rule content and model/review preferences. Only the standing section is rendered through host adapters; the full file is not injected.",
      "assembly_order": 0
    },
    {
      "id": "portable.reconciliation-authority",
      "hosts": [
        "codex",
        "hermes",
        "omp"
      ],
      "kind": "portable-reference",
      "scope": "user-global",
      "status": "active",
      "owner": "tools/reconcile.py",
      "artifact": "tools/reconcile.py",
      "target": "Explicit reconcile-with-Agent-Signal workflow through admitted cross-agent-surface-engineering",
      "model_sensitive": false,
      "backup": "not-effective",
      "note": "Deterministic shared governance authority. Host overlays carry only a concise trigger; novel or unsafe changes remain review-only.",
      "assembly_order": 10
    },
    {
      "id": "provider.native-system",
      "hosts": [
        "provider"
      ],
      "kind": "provider-native",
      "scope": "provider",
      "status": "external",
      "owner": "provider runtime",
      "target": "provider-managed hidden system instructions",
      "model_sensitive": true,
      "backup": "reinstall-runtime",
      "note": "Not user-readable or safely representable as one portable file.",
      "assembly_order": 100
    },
    {
      "id": "hermes.runtime-native",
      "hosts": [
        "hermes"
      ],
      "kind": "runtime-native",
      "scope": "runtime",
      "status": "external",
      "owner": "NousResearch/hermes-agent@0.21.5+2453.gd0288be with reviewed local deltas",
      "target": "Hermes prompt builder",
      "model_sensitive": true,
      "backup": "reinstall-runtime",
      "assembly_order": 110
    },
    {
      "id": "hermes.user-global",
      "hosts": [
        "hermes"
      ],
      "kind": "user-global",
      "scope": "user-global",
      "status": "active",
      "owner": "surfaces/core.md",
      "artifact": "recovery/current/hosts/hermes/SOUL.md",
      "target": "${HERMES_HOME}/SOUL.md",
      "model_sensitive": true,
      "backup": "captured",
      "note": "Generated shared standing rules through adapters/hermes.json; tools/render_instructions.py rejects divergent managed overlays.",
      "assembly_order": 200
    },
    {
      "id": "hermes.project-context",
      "hosts": [
        "hermes"
      ],
      "kind": "project-dynamic",
      "scope": "project",
      "status": "dynamic",
      "owner": "current project",
      "target": "workdir ancestor chain",
      "patterns": [
        "AGENTS.md",
        "CLAUDE.md",
        ".cursorrules"
      ],
      "model_sensitive": false,
      "backup": "project-owned",
      "assembly_order": 300
    },
    {
      "id": "codex.runtime-native",
      "hosts": [
        "codex"
      ],
      "kind": "runtime-native",
      "scope": "runtime",
      "status": "external",
      "owner": "openai/codex@0.158.0-alpha.2.1",
      "target": "Codex prompt builder",
      "model_sensitive": true,
      "backup": "reinstall-runtime",
      "assembly_order": 110
    },
    {
      "id": "codex.user-global",
      "hosts": [
        "codex"
      ],
      "kind": "user-global",
      "scope": "user-global",
      "status": "active",
      "owner": "surfaces/core.md",
      "artifact": "recovery/current/hosts/codex/AGENTS.md",
      "target": "${CODEX_HOME}/AGENTS.md",
      "model_sensitive": true,
      "backup": "captured",
      "note": "Generated shared standing rules through adapters/codex.json; tools/render_instructions.py rejects divergent managed overlays.",
      "assembly_order": 200
    },
    {
      "id": "codex.session-start-hook",
      "hosts": [
        "codex"
      ],
      "kind": "hook-injection",
      "scope": "session",
      "status": "retired",
      "owner": "Codex native hook configuration",
      "target": "${CODEX_HOME}/hooks/run-gsd-check-update.ps1",
      "model_sensitive": false,
      "backup": "retired",
      "note": "The GSD update hook was deliberately removed. Do not reconstruct it from historical recovery. The independent PreToolUse destructive-command guard remains captured.",
      "assembly_order": 250
    },
    {
      "id": "codex.project-context",
      "hosts": [
        "codex",
        "omp"
      ],
      "kind": "project-dynamic",
      "scope": "project",
      "status": "dynamic",
      "owner": "current project",
      "target": "Codex AGENTS hierarchy",
      "patterns": [
        "AGENTS.md"
      ],
      "model_sensitive": false,
      "backup": "project-owned",
      "assembly_order": 300
    },
    {
      "id": "codex.surface-curator-plugin",
      "hosts": [
        "codex"
      ],
      "kind": "hook-injection",
      "scope": "session",
      "status": "disabled",
      "owner": "local agent-surface-governance plugin",
      "target": "Codex plugin hooks",
      "model_sensitive": false,
      "backup": "not-effective",
      "replacement": "tools/reconcile.py",
      "note": "The earlier host-local guard was removed after the shared route and deterministic reconciler were installed and read back. The staged capability-curator is not the replacement authority.",
      "assembly_order": 350
    },
    {
      "id": "omp.runtime-native",
      "hosts": [
        "omp"
      ],
      "kind": "runtime-native",
      "scope": "runtime",
      "status": "external",
      "owner": "oh-my-pi@18.8.9; stock runtime restored from upstream",
      "target": "OMP prompt builder",
      "model_sensitive": true,
      "backup": "reinstall-runtime",
      "assembly_order": 110
    },
    {
      "id": "omp.codex-inherited",
      "hosts": [
        "omp"
      ],
      "kind": "inherited",
      "scope": "user-global",
      "status": "disabled",
      "owner": "oh-my-pi@18.2.6 Codex discovery provider",
      "artifact": "recovery/current/hosts/codex/AGENTS.md",
      "target": "Codex-compatible AGENTS inheritance",
      "model_sensitive": true,
      "backup": "not-effective",
      "note": "OMP 18.2.6 reports empty enabledProviders; a fresh no-session native get_state contains none of the expected standing markers, and no ~/.omp/agent/AGENTS.md exists. Codex inheritance is not effective in this observed configuration.",
      "assembly_order": 200
    },
    {
      "id": "omp.rules-delta",
      "hosts": [
        "omp"
      ],
      "kind": "user-global",
      "scope": "user-global",
      "status": "retired",
      "owner": "recovery/current/hosts/omp/RULES.md",
      "artifact": "recovery/current/hosts/omp/RULES.md",
      "target": "${OMP_HOME}/RULES.md",
      "model_sensitive": true,
      "backup": "retired",
      "replacement": "none",
      "note": "The retired file duplicated a previously assumed Codex inheritance route. Fresh OMP 18.2.6 readback still shows no managed user-global standing overlay.",
      "assembly_order": 210
    },
    {
      "id": "omp.project-context",
      "hosts": [
        "omp"
      ],
      "kind": "project-dynamic",
      "scope": "project",
      "status": "dynamic",
      "owner": "current project",
      "target": "OMP/Codex project hierarchy",
      "patterns": [
        "AGENTS.md"
      ],
      "model_sensitive": false,
      "backup": "project-owned",
      "assembly_order": 300
    },
    {
      "id": "omp.global-instructions",
      "hosts": [
        "omp"
      ],
      "kind": "user-global",
      "scope": "user-global",
      "status": "active",
      "owner": "surfaces/core.md via adapters/omp.json",
      "artifact": "recovery/current/hosts/omp/AGENTS.md",
      "target": "${OMP_HOME}/AGENTS.md",
      "model_sensitive": true,
      "backup": "captured",
      "note": "Public authored delta only; upstream runtime and stock tooling are not captured.",
      "assembly_order": 200
    },
    {
      "id": "omp.reduced-system-template",
      "hosts": [
        "omp"
      ],
      "kind": "user-global",
      "scope": "user-global",
      "status": "active",
      "owner": "checked native OMP reduction",
      "artifact": "recovery/current/hosts/omp/SYSTEM_TEMPLATE.md",
      "target": "${OMP_HOME}/SYSTEM_TEMPLATE.md",
      "model_sensitive": true,
      "backup": "captured",
      "note": "Public authored delta only; upstream runtime and stock tooling are not captured.",
      "assembly_order": 110
    },
    {